{
  "$schema": "https://agent-project-os.org/schemas/activity-event-v1.schema.json",
  "actor": "agent:codex",
  "entity": {
    "id": "real-client-smokes-e1",
    "type": "evidence"
  },
  "event_id": "event-70c2d29563594e11adf15e4e845e1c3c",
  "event_type": "evidence.added",
  "occurred_at": "2026-08-14T09:23:48Z",
  "payload": {
    "grade": "E1",
    "task_id": "v0.1-release-candidate"
  },
  "protocol_version": "1.0",
  "runtime_identity": {
    "client_version": "desktop",
    "runtime": "codex"
  }
}
