{
  "$schema": "https://agent-project-os.org/schemas/activity-event-v1.schema.json",
  "actor": "agent:codex",
  "entity": {
    "id": "v0.1-release-candidate",
    "type": "task"
  },
  "event_id": "event-0882906e916c4e74ad8178b159ca62d2",
  "event_type": "task.updated",
  "occurred_at": "2026-08-18T06:38:47Z",
  "payload": {
    "from": "in_progress",
    "to": "waiting_review"
  },
  "protocol_version": "1.0",
  "runtime_identity": {
    "client_version": "0.147.0-alpha.6.5",
    "runtime": "codex"
  }
}
