{
  "$schema": "https://agent-project-os.org/schemas/activity-event-v1.schema.json",
  "actor": "agent:codex",
  "entity": {
    "id": "v0.1-release-candidate",
    "type": "task"
  },
  "event_id": "event-7863dfce72c746dd8c961823342c540b",
  "event_type": "task.updated",
  "occurred_at": "2026-08-14T09:14:58Z",
  "payload": {
    "from": "in_progress",
    "to": "waiting_review"
  },
  "protocol_version": "1.0",
  "runtime_identity": {
    "client_version": "desktop",
    "runtime": "codex"
  }
}
