{
  "$schema": "https://agent-project-os.org/schemas/activity-event-v1.schema.json",
  "actor": "agent:codex",
  "entity": {
    "id": "release-gate-e2",
    "type": "evidence"
  },
  "event_id": "event-479ad501487b419181c42d9ad6f2f0fd",
  "event_type": "evidence.added",
  "occurred_at": "2026-08-14T09:24:00Z",
  "payload": {
    "grade": "E2",
    "task_id": "v0.1-release-candidate"
  },
  "protocol_version": "1.0",
  "runtime_identity": {
    "client_version": "desktop",
    "runtime": "codex"
  }
}
