{
  "$schema": "https://agent-project-os.org/schemas/activity-event-v1.schema.json",
  "actor": "agent:codex",
  "entity": {
    "id": "v0.1-release-candidate",
    "type": "task"
  },
  "event_id": "event-990c480172b94c47ab43faaab8fb4e0b",
  "event_type": "task.updated",
  "occurred_at": "2026-08-14T09:24:00Z",
  "payload": {
    "from": "waiting_review",
    "to": "done"
  },
  "protocol_version": "1.0",
  "runtime_identity": {
    "client_version": "desktop",
    "runtime": "codex"
  }
}
