{
  "$schema": "https://agent-project-os.org/schemas/activity-event-v1.schema.json",
  "actor": "human:project-owner",
  "entity": {
    "id": "core-boundary-v1",
    "type": "decision"
  },
  "event_id": "event-234460d5117c4f46bae6eaaf14e15fd5",
  "event_type": "decision.accepted",
  "occurred_at": "2026-08-14T09:14:58Z",
  "payload": {},
  "protocol_version": "1.0",
  "runtime_identity": {
    "client_version": "approved-plan",
    "runtime": "manual"
  }
}
