{
  "$schema": "https://agent-project-os.org/schemas/activity-event-v1.schema.json",
  "actor": "agent:codex",
  "entity": {
    "id": "v0.1-release-candidate",
    "type": "task"
  },
  "event_id": "event-e21a3862ffe04fe68b67500de66ff4c8",
  "event_type": "task.updated",
  "occurred_at": "2026-08-14T09:14:57Z",
  "payload": {
    "from": "ready",
    "to": "in_progress"
  },
  "protocol_version": "1.0",
  "runtime_identity": {
    "client_version": "desktop",
    "runtime": "codex"
  }
}
